{
  "version": "1.0",
  "name": "Baseline (generated from legacy ENGAGEMENT_PRIORITY)",
  "typeOrder": ["mrbm", "srbm", "cruise_missile", "drone_jet", "drone", "fpv"],
  "engage": {
    "mrbm": ["aegis_sm3", "thaad", "arrow", "patriot", "davids_sling", "cheongung2", "aegis_sm6"],
    "srbm": ["aegis_sm3", "thaad", "arrow", "patriot", "davids_sling", "cheongung2", "aegis_sm6"],
    "cruise_missile": [
      "f15e_patrol",
      "fa18_patrol",
      "patriot",
      "davids_sling",
      "cheongung2",
      "aegis_sm2",
      "aegis_sm6",
      "iron_dome",
      "nasams",
      "ifpc2",
      "pantsirs1e"
    ],
    "drone_jet": [
      "f15e_patrol",
      "fa18_patrol",
      "patriot",
      "davids_sling",
      "cheongung2",
      "aegis_sm2",
      "aegis_sm6",
      "iron_dome",
      "nasams",
      "ifpc2",
      "pantsirs1e",
      "iron_beam",
      "containerized_laser",
      "m_shorad",
      "phalanx_cram"
    ],
    "drone": [
      "f15e_patrol",
      "fa18_patrol",
      "patriot",
      "davids_sling",
      "cheongung2",
      "aegis_sm2",
      "aegis_sm6",
      "iron_dome",
      "nasams",
      "ifpc2",
      "pantsirs1e",
      "fslids",
      "merops",
      "iron_beam",
      "containerized_laser",
      "m_shorad",
      "phalanx_cram",
      "high_powered_microwave",
      "tactical_jammer"
    ],
    "fpv": [
      "f15e_patrol",
      "fa18_patrol",
      "patriot",
      "davids_sling",
      "cheongung2",
      "aegis_sm2",
      "aegis_sm6",
      "iron_dome",
      "nasams",
      "ifpc2",
      "pantsirs1e",
      "fslids",
      "merops",
      "iron_beam",
      "containerized_laser",
      "m_shorad",
      "phalanx_cram",
      "high_powered_microwave",
      "tactical_jammer"
    ]
  }
}
